question,answer_1,answer_2,answer_3,answer_4,correct_answer_1,correct_answer_2
Was ist der Hauptzweck von AWS Lambda?,Ausführung von Code in Reaktion auf Ereignisse,Automatisierung von Netzwerkprozessen,Management von Datenbanken,Direkte Anbindung an physische Netzwerke,Ausführung von Code in Reaktion auf Ereignisse,
Was ermöglicht Amazon API Gateway?,Erstellen, veröffentlichen, verwalten und sichern von APIs,Verbesserung der Netzwerksicherheit,Speicherung von Objektdaten,Verbesserung der Datenbanksicherheit,Erstellen, veröffentlichen, verwalten und sichern von APIs,
Wie unterstützt AWS Fargate serverlose Architekturen?,Durch Automatisierung der Server- und Cluster-Verwaltung für Container,Ermöglichung von Hochgeschwindigkeitsdatenübertragungen,Optimierung der Speicherkosten,Erhöhung der Netzwerkbandbreite,Durch Automatisierung der Server- und Cluster-Verwaltung für Container,
Welche Funktion bietet Amazon S3 in einer serverlosen Architektur?,Speicherung und Abruf jeglicher Menge von Daten zu jeder Zeit,Speicherung von SQL-Datenbanken,Verwaltung von Netzwerkressourcen,Direkte Steuerung von physischen Geräten,Speicherung und Abruf jeglicher Menge von Daten zu jeder Zeit,
Wie interagiert Amazon DynamoDB mit serverlosen Anwendungen?,Bietet eine vollständig verwaltete NoSQL-Datenbanklösung,Verbesserung der E-Mail-Datensicherheit,Automatisierung von Marketingkampagnen,Verbesserung der physischen Serverleistung,Bietet eine vollständig verwaltete NoSQL-Datenbanklösung,
Was ermöglicht AWS Step Functions in serverlosen Workflows?,Koordination von Funktionen und automatisierte Abläufe,Optimierung der Netzwerkleistung,Erhöhung der Datenbanksicherheit,Reduzierung der Kosten für Cloud-Speicherung,Koordination von Funktionen und automatisierte Abläufe,
Was ist Amazon EventBridge?,Ein serverloser Event Bus, der Anwendungsdaten aus verschiedenen Quellen integriert,Tool zur Netzwerksicherheit,Service zur Datenvisualisierung,Plattform für maschinelles Lernen,Ein serverloser Event Bus, der Anwendungsdaten aus verschiedenen Quellen integriert,
Was ist der Vorteil von AWS SAM (Serverless Application Model)?,Vereinfachung der Entwicklung und Bereitstellung von serverlosen Anwendungen,Verbesserung der Anwendungssicherheit,Beschleunigung der Datenmigration,Optimierung der physischen Netzwerkinfrastruktur,Vereinfachung der Entwicklung und Bereitstellung von serverlosen Anwendungen,
Wie verbessert AWS Lambda die Skalierbarkeit von Anwendungen?,Durch automatische Skalierung basierend auf der Anforderung, ohne Server zu verwalten,Erhöhung der Netzwerkbandbreite,Bereitstellung von dedizierten Datenbankservices,Verbesserung der physischen Sicherheitsmaßnahmen,Durch automatische Skalierung basierend auf der Anforderung, ohne Server zu verwalten,
Welche Rolle spielt Amazon Kinesis in einer serverlosen Architektur?,Verarbeitung und Analyse von Streaming-Daten in Echtzeit,Verbesserung der Netzwerkleistung,Management von Cloud-basierten Datenbanken,Optimierung von Anwendungsantwortzeiten,Verarbeitung und Analyse von Streaming-Daten in Echtzeit,
Wie interagiert Amazon SQS mit AWS Lambda?,Kann Ereignisse an AWS Lambda senden, um Code in Reaktion auf Nachrichten auszuführen,Optimierung der Datenübertragungsgeschwindigkeit,Verwaltung von Netzwerkswitches,Verbesserung der Sicherheit von Webanwendungen,Kann Ereignisse an AWS Lambda senden, um Code in Reaktion auf Nachrichten auszuführen,
Was ist Amazon SNS im Kontext von serverlosen Architekturen?,Ein vollständig verwalteter Pub/Sub-Nachrichtendienst, der Komponenten einer Anwendung durch Nachrichten miteinander verbindet,Tool zur Datenverschlüsselung,Service zur Verwaltung von SQL-Datenbanken,Dienst zur Netzwerklastverteilung,Ein vollständig verwalteter Pub/Sub-Nachrichtendienst, der Komponenten einer Anwendung durch Nachrichten miteinander verbindet,
Wie funktioniert AWS AppSync in serverlosen Architekturen?,Als verwalteter GraphQL-Service, der Daten von einem oder mehreren Quellen mit Echtzeit-Updatemöglichkeiten abruft,Datenbankcluster-Management,Optimierung der Cloud-Speicherkosten,Bereitstellung von Netzwerkfirewalls,Als verwalteter GraphQL-Service, der Daten von einem oder mehreren Quellen mit Echtzeit-Updatemöglichkeiten abruft,
Wie wird Amazon API Gateway mit AWS Lambda verwendet?,API Gateway kann als HTTP-Endpunkt dienen, der Anfragen an AWS Lambda zur Verarbeitung weiterleitet,Verbesserung der Datenbankzugriffszeiten,Bereitstellung eines VPN-Tunnels,Verwaltung von physischen Netzwerkgeräten,API Gateway kann als HTTP-Endpunkt dienen, der Anfragen an AWS Lambda zur Verarbeitung weiterleitet,
Welche Funktion hat AWS CloudFormation in serverlosen Architekturen?,Ermöglicht das Modellieren und Einrichten von AWS-Ressourcen und serverlosen Anwendungen mittels Code,Steigerung der Datenverarbeitungsgeschwindigkeit,Verbesserung der physischen Sicherheit,Optimierung der Netzwerkinfrastruktur,Ermöglicht das Modellieren und Einrichten von AWS-Ressourcen und serverlosen Anwendungen mittels Code,
